text_id,domain,model,summary,inference_time
S4,Sports,M4,"Sports as a Unifying Global Language Few things bridge cultural and linguistic divides as effectively as sports. Major international events like the Olympics or the FIFA World Cup serve as a form of ""soft power,"" allowing nations to project their identity and values on a global stage while simultaneously fostering diplomatic dialogue. On a community level, sports provide a shared fabric of identity; a local team often becomes a proxy for civic pride. The rules of a game provide a universal framework where strangers can interact with immediate understanding and mutual respect, creating a unique social glue that binds disparate groups together through shared triumph and collective heartbreak.",15.148
S5,Sports,M4,"Strategic Complexity and Game Theory At the highest level, team sports are essentially played out as complex games of chess with living pieces. Coaches must balance rigid structure with creative freedom. For instance, in soccer (football), the evolution of formation strategies—from the W-M formation of the 1920s to the fluid ""Total Football"" of the 1970s and modern high-pressing systems—demonstrates a constant tactical arms race. These systems require players to have high spatial awareness, understanding not just their position but how their movement creates space for teammates. This tactical depth transforms a chaotic physical contest into an intellectual battle for spatial dominance",16.401
M1,Music,M4,"The Mathematics of Harmony At its core, music is a physical manifestation of mathematics. The relationship between pitches is defined by frequency ratios; a perfect octave, for example, is a 2:1 ratio, while a perfect fifth is 3:2. Western music theory organizes these relationships into the Circle of Fifths, a geometric representation of the 12 chromatic pitches. This tool allows composers to navigate key changes and understand harmonic progression. By moving clockwise, you add sharps to the key signature; moving counter-clockwise adds flats. This structure is not arbitrary but is based on the physics of sound waves and how the human",18.131
M2,Music,M4,"The Psychology of Rhythm and Entrainment Rhythm has a profound effect on the human brain, capable of inducing a state known as ""entrainment."" This occurs when the body's internal rhythms—such as heart rate and brain waves—synchronize with external musical beats. This is why upbeat, fast-tempo music is often used for exercise; it naturally encourages a faster pace and higher energy output. Conversely, slower tempos with specific rhythmic structures can lower cortisol levels and induce relaxation. This connection is deeply rooted in our evolutionary history, where communal drumming and rhythmic movement served as vital tools for social bonding and communication before",15.717
M3,Music,M4,"The Evolution of Synthesis The introduction of the synthesizer revolutionized modern music by detaching sound generation from physical acoustics. Early analog synthesizers used voltage-controlled oscillators to generate waveforms like sine, square, and sawtooth waves. By manipulating these waves with filters (subtractive synthesis) or combining them (additive synthesis), musicians could create entirely new timbres that no physical instrument could produce. Today, digital synthesis methods like Frequency Modulation (FM) and wavetable synthesis allow for even more complex sound design, enabling the ""futuristic"" textures found in genres ranging from 80s pop to",16.503
M4,Music,M4,"The Role of Dynamics and Timbre While melody and rhythm often get the most attention, the emotional impact of a piece is heavily reliant on dynamics and timbre. Dynamics refer to the variation in loudness between notes or phrases, adding drama and intensity; a sudden fortissimo (very loud) crash after a pianissimo (very soft) passage creates a visceral shock. Timbre, or ""tone color,"" is what distinguishes a violin from a flute playing the exact same note. It is determined by the harmonic content of the sound—the specific blend of overtones that accompanies the fundamental frequency. Mastery of timbre allows composers",20.993
M5,Music,M4,"The Shift to Streaming Economics The music industry has undergone a seismic shift from physical sales to the access model of streaming. In the past, revenue was generated by the unit sale of albums or singles. Today, the ""value gap"" is a major topic of debate, as revenue is calculated based on pro-rata market share of streams. This has changed how music is written; songs are often shorter to encourage repeat plays, and ""hooks"" (catchy choruses) are introduced much earlier in the track to prevent listeners from skipping within the first 30 seconds—the threshold often required for a stream to count toward royalties.",16.435
F1,Finance,M4,"The Power of Compound Interest Often called the ""eighth wonder of the world,"" compound interest is the principle that allows wealth to grow exponentially rather than linearly. Unlike simple interest, which is calculated only on the principal amount, compound interest is calculated on the principal plus the accumulated interest from previous periods. This creates a snowball effect: over time, the interest itself earns interest. For long-term investors, time is a more critical asset than the initial capital; starting to save a small amount in one's 20s can often yield a larger retirement fund than saving a large amount starting in one's 40s, simply due to the comp",16.012
F2,Finance,M4,"Technical Analysis and Market Sentiment Traders often use technical analysis to predict future price movements based on historical data. A primary tool for this is the candlestick chart, which provides more information than a simple line graph. Each ""candle"" displays the high, low, open, and close prices for a specific time period. The ""body"" shows the difference between open and close, while the ""wicks"" show the extreme highs and lows. Patterns in these charts, such as ""doji"" or ""hammer"" formations, act as visual representations of market psychology, indicating whether buyers (bulls) or sellers (bears",20.91
F3,Finance,M4,"Diversification and Risk Management The adage ""don't put all your eggs in one basket"" is the cornerstone of modern portfolio theory. Diversification involves spreading investments across various asset classes—such as stocks, bonds, real estate, and commodities—to reduce exposure to any single risk. The goal is to maximize returns for a given level of risk. When one asset class underperforms (e.g., stocks crash), another might hold steady or rise (e.g., bonds or gold), smoothing out the overall volatility of the portfolio. This strategy acknowledges that market timing is nearly impossible and that mitigating downside risk is as",16.891
F4,Finance,M4,"The Mechanics of Inflation Inflation represents the rate at which the general level of prices for goods and services is rising, and, subsequently, how purchasing power is falling. Central banks, like the Federal Reserve, attempt to manage this through monetary policy, primarily by adjusting interest rates. When inflation is high, banks raise rates to cool down the economy by making borrowing more expensive; when it is low, they cut rates to stimulate spending. Understanding inflation is crucial for financial planning because if an investment portfolio's return does not outpace the inflation rate, the investor is effectively losing real wealth over time, even if the nominal value of their account is",16.584
F5,Finance,M4,"The Role of liquidity In financial markets, liquidity refers to the efficiency or ease with which an asset or security can be converted into ready cash without affecting its market price. Cash is the most liquid asset, while tangible items like real estate or fine art are illiquid because selling them takes time and effort. High liquidity in a market (like the forex or major stock markets) means tight spreads between the bid and ask prices, allowing for easy entry and exit. During financial crises, liquidity can ""dry up,"" causing panic as investors find themselves unable to sell assets to raise cash without accepting a steep discount.",15.445
P1,Politics,M5," At the heart of modern political theory lies the concept of the social contract, a philosophical framework exploring the origins of society and the legitimacy of the state . This theory posits that individuals implicitly agree to surrender some of their freedoms in exchange for protection of their remaining rights and the maintenance of social order .",17.974
P2,Politics,M5," The separation of powers is designed to prevent the concentration of authority in a single entity . This system relies heavily on ""checks and balances,"" where each branch has the authority to limit the powers of the others . This friction is intentional; it forces negotiation and compromise .",8.65
P3,Politics,M5," Increasingly, nations rely on ""soft power"" to shape preferences of others through appeal and attraction rather than coercion . This form of power stems from a country's culture, political values, and foreign policies . Soft power suggests that winning hearts and minds can be just as crucial as winning wars in securing geopolitical stability .",9.822
P4,Politics,M5," Politics translates into reality through public policy, the dynamic process by which governments address public issues . It is not merely the passage of laws but a continuous cycle of agenda setting, formulation, adoption, implementation, and evaluation . Effective policy requires navigating the competing interests of stakeholders, including lobbyists, civil society groups, and the electorate .",9.241
P5,Politics,M5," The health of a political system is often gauged by the level of civic engagement among its populace . Participatory democracy involves active citizen involvement in the decision-making processes that affect their lives . This can take many forms, from attending town hall meetings to engaging in grassroots activism .",8.711
S1,Sports,M5," Modern athletic training has transcended simple physical conditioning to become a highly scientific discipline . Technology plays a massive role here; wearable sensors now track everything from heart rate variability to sleep quality and acceleration loads . Recovery has also become as important as the workout itself, with cryotherapy, hyperbaric oxygen chambers, and pneumatic compression devices becoming standard tools .",10.723
S2,Sports,M5," Sports psychology focuses on what separates good athletes from great ones . This mental toughness is often described as being in ""the zone"" or ""flow state"" Mastering this mental game is often the deciding factor in high-stakes penalty shootouts or buzzer-beating shots .",8.976
S3,Sports,M5," The era of ""gut feeling"" management has largely given way to advanced analytics . Teams across all major sports now employ data scientists to find inefficiencies in the game . In basketball, this led to the ""three-point revolution,"" where mathematical probability dictated that shooting more from deep was more efficient than mid-range jumpers .",11.124
S4,Sports,M5," Major international events like the Olympics or the FIFA World Cup serve as a form of ""soft power"" The rules of a game provide a universal framework where strangers can interact with immediate understanding . Sports provide a shared fabric of identity; a local team often becomes a proxy for civic pride .",8.111
S5,Sports,M5," At the highest level, team sports are essentially played out as complex games of chess with living pieces . Coaches must balance rigid structure with creative freedom . Evolution of formation strategies in soccer (football)demonstrates a constant tactical arms race .",8.116
M1,Music,M5," Western music theory organizes relationships into the Circle of Fifths, a geometric representation of the 12 chromatic pitches . This tool allows composers to navigate key changes and understand harmonic progression . By moving clockwise, you add sharps to the key signature; moving counter-clockwise adds flats .",9.467
M2,Music,M5," Rhythm has a profound effect on the human brain, capable of inducing a state known as ""entrainment"" This is when the body's internal rhythms synchronize with external musical beats . This is why upbeat, fast-tempo music is often used for exercise . Conversely, slower tempos with specific rhythmic structures can lower cortisol levels .",9.553
M3,Music,M5," Early analog synthesizers used voltage-controlled oscillators to generate waveforms like sine, square, and sawtooth waves . By manipulating these waves with filters or combining them, musicians could create entirely new timbres . Today, digital synthesis methods like Frequency Modulation (FM) and wavetable synthesis allow for even more complex sound design .",10.618
M4,Music,M5," Dynamics refer to variation in loudness between notes or phrases, adding drama and intensity . Timbre, or ""tone color,"" is what distinguishes a violin from a flute playing the exact same note . Mastery of timbre allows composers to ""paint"" with sound .",8.817
M5,Music,M5," The music industry has undergone a seismic shift from physical sales to the access model of streaming . In the past, revenue was generated by the unit sale of albums or singles . Today, revenue is calculated based on pro-rata market share of streams .",7.715
F1,Finance,M5," Compound Interest is the principle that allows wealth to grow exponentially rather than linearly . Compound interest is calculated on the principal plus accumulated interest from previous periods . This creates a snowball effect: over time, the interest itself earns interest . For long-term investors, time is a more critical asset than initial capital .",9.423
F2,Finance,M5," Traders often use technical analysis to predict future price movements based on historical data . A primary tool for this is the candlestick chart, which provides more information than a simple line graph . Patterns in these charts act as visual representations of market psychology .",9.873
F3,Finance,M5," The adage ""don't put all your eggs in one basket"" is the cornerstone of modern portfolio theory . Diversification involves spreading investments across various asset classes to reduce exposure to any single risk . The goal is to maximize returns for a given level of risk .",8.956
F4,Finance,M5," Central banks attempt to manage inflation through monetary policy . When inflation is high, banks raise rates to cool down the economy by making borrowing more expensive . When it is low, they cut rates to stimulate spending . Understanding inflation is crucial for financial planning .",9.033
F5,Finance,M5," In financial markets, liquidity refers to efficiency or ease with which an asset can be converted into ready cash without affecting its market price . Cash is the most liquid asset, while tangible items like real estate or fine art are illiquid because selling them takes time and effort . High liquidity in a market (like the forex or major stock markets) means tight spreads between the bid and ask prices .",14.543
